{"schema": "ao.result-cache.entry/v1", "key": "6646469e94a695fe1a994d35f54ca74e007262911255552b03c54ce2e5d0319f", "key_schema": 1, "created_at": "2026-10-05T10:15:02+00:00", "source": {"workflow_id": "doc-pipeline", "task_id": "summarize", "run_id": "rrrrrrrrrrrrrrrrrrrrrrrrrrrrrrrrrrrrrrrrrrrrrrrrrrrrrrrrrrrrrrrrrrrrrrrrrrrrrrrrrrrrrrrrrrrrrrrrrrrrrrrrrrrrrrrrrrrrrrrrrrrrrrrrrrrrrrrrrrrrrrrrrrrrrrrrrrrrrrrrrrrrrrrrrrrrrrrrrrrrrrrrrrrrrrrrrrrrrrrrrrrrrrrrrrrrrrrrrrrrrrrrrrrrrrrrrrrrrrrrrrrrrrrrrrrrrrrrrrrrrrrrrrrrrrrrrrrrrrrrrrrrrrrrrrrrrrrrrrrr", "agent": "writer", "ao_version": "0.1.0", "cli_version": "2.1.278 (Claude Code)"}, "usage": {"cost_usd": 0.4123, "input_tokens": 12000, "output_tokens": 3400, "cache_creation_input_tokens": 0, "cache_read_input_tokens": 8000, "duration_seconds": 95.2, "attempts": 1, "model": "sonnet", "effort": "medium", "actuals_available": true}, "outputs": [{"path": "out/summary.md", "kind": "file", "sha256": "9c1f000000000000000000000000000000000000000000000000000000000000", "size": 1834, "mode": 420}], "key_summary": {"key_schema": 1, "executor": "claude_cli", "model": "sonnet", "effort": "medium", "max_turns": null, "instruction": "specs/instr/s.md", "inputs": ["docs/notes.md"], "dynamic_inputs": [], "general_instructions": [], "outputs": ["out/summary.md"], "digests": {"docs/notes.md": "9c1f000000000000000000000000000000000000000000000000000000000000"}, "repo_heads": null, "components": {"agent": "ced58570dab6"}}}